{"schema":"https://debz.dev/schema/transaction-result-v3","version":3,"target_architecture":"amd64","request_sha256":"0000000000000000000000000000000000000000000000000000000000000000","solver_policy_sha256":"1111111111111111111111111111111111111111111111111111111111111111","executor_policy_sha256":"0303030303030303030303030303030303030303030303030303030303030303","plan_sha256":"0404040404040404040404040404040404040404040404040404040404040404","lock_sha256":"9d3535edadd65511998ac3e2b55707cd65860d4d72445879214eb387645c21eb","repositories":[],"packages":[{"name":"seed","version":"1","architecture":"all","origin":{"type":"local_artifact","artifact_id":{"algorithm":"sha512","digest":"33333333333333333333333333333333333333333333333333333333333333333333333333333333333333333333333333333333333333333333333333333333"},"archive_identity":{"primary":"sha512","digests":[{"algorithm":"sha256","digest":"2222222222222222222222222222222222222222222222222222222222222222"},{"algorithm":"sha512","digest":"33333333333333333333333333333333333333333333333333333333333333333333333333333333333333333333333333333333333333333333333333333333"}]},"size":1,"package":{"name":"seed","version":"1","architecture":"all"},"acquisition_url":"https://example.invalid/seed.deb","trust_mode":"pinned_content_digest"},"package_identity":{"primary":"sha512","digests":[{"algorithm":"sha256","digest":"2222222222222222222222222222222222222222222222222222222222222222"},{"algorithm":"sha512","digest":"33333333333333333333333333333333333333333333333333333333333333333333333333333333333333333333333333333333333333333333333333333333"}]},"cas_identity":{"primary":"sha512","digests":[{"algorithm":"sha256","digest":"2222222222222222222222222222222222222222222222222222222222222222"},{"algorithm":"sha512","digest":"33333333333333333333333333333333333333333333333333333333333333333333333333333333333333333333333333333333333333333333333333333333"}]},"declared_size":1}],"commands":[],"journal_steps":[],"recovery_steps":[],"final_verification":{"status":"exact_match","installed_state_sha256":"0606060606060606060606060606060606060606060606060606060606060606","package_origins_sha256":"9d3535edadd65511998ac3e2b55707cd65860d4d72445879214eb387645c21eb","detail":"verified"},"outcome":"succeeded","diagnostic":"","digest_sha256":"ad847f0c0d64bf2ea195b93137c77ce3a9413122a186cd8e69a2cecf107e5fec"}